{
  "report_id": "bive-report-0001",
  "created_at": "2026-06-10T18:53:28Z",
  "subject_scope": "single_session",
  "input_summary": {
    "segments": 2,
    "claims": 3,
    "modalities": [
      "text"
    ],
    "evidence_graph_entropy": 0.8636,
    "graph_nodes": 12,
    "graph_edges": 18
  },
  "claims": [
    {
      "claim_id": "claim:0:0",
      "speaker": "speaker_1",
      "text": "Trust me, nobody needs to check this today.",
      "start": 0.0,
      "end": 4.2,
      "source_id": "segment:0",
      "qualifiers": [
        "absolute",
        "temporal"
      ]
    },
    {
      "claim_id": "claim:0:1",
      "speaker": "speaker_1",
      "text": "I never received that money.",
      "start": 0.0,
      "end": 4.2,
      "source_id": "segment:0",
      "qualifiers": [
        "absolute"
      ]
    },
    {
      "claim_id": "claim:1:0",
      "speaker": "speaker_1",
      "text": "I received that money later, but it was obviously not my responsibility.",
      "start": 8.0,
      "end": 12.5,
      "source_id": "segment:1",
      "qualifiers": [
        "absolute"
      ]
    }
  ],
  "signals": [
    {
      "signal_id": "signal:linguistic_event_count",
      "modality": "text",
      "name": "linguistic_event_count",
      "value": 5,
      "confidence": 0.8,
      "interpretation": "Count of conservative linguistic evidence events extracted from claims.",
      "limitations": [
        "High count is not deception; it only increases review surface."
      ]
    }
  ],
  "evidence_events": [
    {
      "event_id": "event:absolute_framing:claim:0:0",
      "source_id": "segment:0",
      "modality": "text",
      "feature": "absolute_framing",
      "value": "absolute wording",
      "confidence": 0.6,
      "direction": "supports",
      "magnitude": 0.35,
      "timestamp_start": 0.0,
      "timestamp_end": 4.2,
      "hypothesis_refs": [
        "H_MANIPULATION_RISK",
        "H_INCONSISTENCY_RISK"
      ],
      "limitations": [
        "Language-only cue; must be checked against context and counter-evidence."
      ],
      "provenance": {
        "entity_id": "claim:0:0",
        "activity": "linguistic_feature_extraction",
        "agent": "bive.linguistics.LinguisticAnalyzer",
        "source": "segment:0",
        "generated_at": "2026-06-10T18:53:28Z",
        "parameters": {
          "feature": "absolute_framing"
        }
      }
    },
    {
      "event_id": "event:verification_pressure:claim:0:0",
      "source_id": "segment:0",
      "modality": "text",
      "feature": "verification_pressure",
      "value": "discourages verification",
      "confidence": 0.7,
      "direction": "supports",
      "magnitude": 0.55,
      "timestamp_start": 0.0,
      "timestamp_end": 4.2,
      "hypothesis_refs": [
        "H_MANIPULATION_RISK",
        "H_INCONSISTENCY_RISK"
      ],
      "limitations": [
        "Language-only cue; must be checked against context and counter-evidence."
      ],
      "provenance": {
        "entity_id": "claim:0:0",
        "activity": "linguistic_feature_extraction",
        "agent": "bive.linguistics.LinguisticAnalyzer",
        "source": "segment:0",
        "generated_at": "2026-06-10T18:53:28Z",
        "parameters": {
          "feature": "verification_pressure"
        }
      }
    },
    {
      "event_id": "event:temporal_anchor:claim:0:0",
      "source_id": "segment:0",
      "modality": "text",
      "feature": "temporal_anchor",
      "value": "time anchor present",
      "confidence": 0.65,
      "direction": "neutral",
      "magnitude": 0.25,
      "timestamp_start": 0.0,
      "timestamp_end": 4.2,
      "hypothesis_refs": [
        "H_MANIPULATION_RISK",
        "H_INCONSISTENCY_RISK"
      ],
      "limitations": [
        "Language-only cue; must be checked against context and counter-evidence."
      ],
      "provenance": {
        "entity_id": "claim:0:0",
        "activity": "linguistic_feature_extraction",
        "agent": "bive.linguistics.LinguisticAnalyzer",
        "source": "segment:0",
        "generated_at": "2026-06-10T18:53:28Z",
        "parameters": {
          "feature": "temporal_anchor"
        }
      }
    },
    {
      "event_id": "event:absolute_framing:claim:0:1",
      "source_id": "segment:0",
      "modality": "text",
      "feature": "absolute_framing",
      "value": "absolute wording",
      "confidence": 0.6,
      "direction": "supports",
      "magnitude": 0.35,
      "timestamp_start": 0.0,
      "timestamp_end": 4.2,
      "hypothesis_refs": [
        "H_MANIPULATION_RISK",
        "H_INCONSISTENCY_RISK"
      ],
      "limitations": [
        "Language-only cue; must be checked against context and counter-evidence."
      ],
      "provenance": {
        "entity_id": "claim:0:1",
        "activity": "linguistic_feature_extraction",
        "agent": "bive.linguistics.LinguisticAnalyzer",
        "source": "segment:0",
        "generated_at": "2026-06-10T18:53:28Z",
        "parameters": {
          "feature": "absolute_framing"
        }
      }
    },
    {
      "event_id": "event:absolute_framing:claim:1:0",
      "source_id": "segment:1",
      "modality": "text",
      "feature": "absolute_framing",
      "value": "absolute wording",
      "confidence": 0.6,
      "direction": "supports",
      "magnitude": 0.35,
      "timestamp_start": 8.0,
      "timestamp_end": 12.5,
      "hypothesis_refs": [
        "H_MANIPULATION_RISK",
        "H_INCONSISTENCY_RISK"
      ],
      "limitations": [
        "Language-only cue; must be checked against context and counter-evidence."
      ],
      "provenance": {
        "entity_id": "claim:1:0",
        "activity": "linguistic_feature_extraction",
        "agent": "bive.linguistics.LinguisticAnalyzer",
        "source": "segment:1",
        "generated_at": "2026-06-10T18:53:28Z",
        "parameters": {
          "feature": "absolute_framing"
        }
      }
    }
  ],
  "hypotheses": [
    {
      "hypothesis_id": "H_INCONSISTENCY_RISK",
      "label": "inconsistency_risk",
      "description": "Risk that claims contain unresolved contradictions, timeline tensions or semantic incompatibilities.",
      "prior": 0.5,
      "evidence_for": [
        "event:absolute_framing:claim:0:0",
        "event:verification_pressure:claim:0:0",
        "event:absolute_framing:claim:0:1",
        "event:absolute_framing:claim:1:0"
      ],
      "evidence_against": [],
      "score": 0.6575,
      "uncertainty": 0.5109,
      "status": "review_required",
      "alternative_explanations": [
        "imprecise wording rather than deception",
        "translation or dialect mismatch",
        "memory uncertainty",
        "stress-induced simplification",
        "defensive communication under pressure",
        "Language-only cue; must be checked against context and counter-evidence.",
        "single modality penalty applied"
      ]
    },
    {
      "hypothesis_id": "H_MANIPULATION_RISK",
      "label": "manipulation_risk",
      "description": "Risk that communication attempts to reduce verification, pressure interpretation or control the review frame.",
      "prior": 0.5,
      "evidence_for": [
        "event:absolute_framing:claim:0:0",
        "event:verification_pressure:claim:0:0",
        "event:absolute_framing:claim:0:1",
        "event:absolute_framing:claim:1:0"
      ],
      "evidence_against": [],
      "score": 0.6575,
      "uncertainty": 0.5109,
      "status": "review_required",
      "alternative_explanations": [
        "imprecise wording rather than deception",
        "translation or dialect mismatch",
        "memory uncertainty",
        "stress-induced simplification",
        "defensive communication under pressure",
        "Language-only cue; must be checked against context and counter-evidence.",
        "single modality penalty applied"
      ]
    },
    {
      "hypothesis_id": "H_COGNITIVE_LOAD_RISK",
      "label": "cognitive_load_risk",
      "description": "Risk that observed signals suggest high cognitive load, without implying deception.",
      "prior": 0.5,
      "evidence_for": [],
      "evidence_against": [],
      "score": 0.0,
      "uncertainty": 1.0,
      "status": "inconclusive",
      "alternative_explanations": [
        "no evidence"
      ]
    },
    {
      "hypothesis_id": "H_EVIDENCE_GAP_RISK",
      "label": "evidence_gap_risk",
      "description": "Risk that available evidence is too incomplete for reliable assessment.",
      "prior": 0.5,
      "evidence_for": [],
      "evidence_against": [],
      "score": 0.0,
      "uncertainty": 1.0,
      "status": "inconclusive",
      "alternative_explanations": [
        "no evidence"
      ]
    }
  ],
  "final_status": "review_required",
  "final_assessment": "Status: review_required. The system extracted 3 claims and 5 evidence events. Top hypotheses: inconsistency_risk=0.66/u=0.51, manipulation_risk=0.66/u=0.51. Evidence graph entropy=0.86. This is a review surface, not a person-level verdict.",
  "limitations": [
    "This report is not a lie detector and must not be used as an automated accusation.",
    "Nonverbal and paralinguistic cues are weak without baseline, context, and corroborating evidence.",
    "Text-only analysis cannot infer physiology, identity, intent, or guilt.",
    "Real-world use requires human review, source provenance, and domain-specific validation."
  ],
  "missing_evidence": [
    "speaker baseline across neutral conditions",
    "external factual timeline",
    "raw audio/video quality metrics",
    "independent corroborating documents"
  ],
  "verification_questions": [
    "Can the time anchor in claim `claim:0:0` be verified by an independent source?",
    "What evidence would falsify the absolute wording in claim `claim:0:0`?",
    "What evidence would falsify the absolute wording in claim `claim:0:1`?",
    "What evidence would falsify the absolute wording in claim `claim:1:0`?",